### ISSUE TITLE
FIN without SERVFAIL on TCP lookup to failing hostnames

### ISSUE THREAD

**Issue by johnhtodd** [NLnetLabs/unbound#69]
Version: 1.9.2

Short description: Sporadically, TCP-based lookups for records that result in SERVFAIL will result in a FIN being sent early to the client instead of SRVFAIL and then a FIN.  Subsequent replies for the same record then result in the expected SRVFAIL response code and normal TCP flow until cache timeout.

Steps to reproduce (unbound on port 5000):

[root@test log]# kdig @127.0.0.1 -p 5000 +tcp +retry=1 rhybar.cz
;; WARNING: can't receive reply from 127.0.0.1@5000(TCP)
;; WARNING: failed to query server 127.0.0.1@5000(TCP)
[root@test log]#
[root@test log]# kdig @127.0.0.1 -p 5000 +tcp +retry=1 rhybar.cz
;; ->>HEADER<<- opcode: QUERY; status: SERVFAIL; id: 22768
;; Flags: qr rd ra; QUERY: 1; ANSWER: 0; AUTHORITY: 0; ADDITIONAL: 0

;; QUESTION SECTION:
;; rhybar.cz.          		IN	A

;; Received 27 B
;; Time 2019-08-23 20:14:34 UTC
;; From 127.0.0.1@5000(TCP) in 0.1 ms
[root@test log]#

From unbound.log:
Aug 23 20:14:30 res310 unbound: [10242:1] info: validation failure rhybar.cz. A IN
Aug 23 20:14:30 res310 unbound: [10242:1] info: validation failure rhybar.cz. NS IN

Long description:
This has been observed with many other SRVFAIL responses, though rhybar.cz does tend to fail much more predictably and has a validation failure.  Another randomly-picked servfail test element that has been used with less consistently reproducable results: ns.hesjptt.net.cn

Packet captures were done on these transactions, and there is a FIN sent by unbound around 200ms after the receipt of the query on TCP sessions. 

If this is a configuration issue, advice would be welcome on what we should look at.

**Comment by wcawijngaards** [comment]
When I try the rhybar.cz name, it does not fail for me.  It gives servfail with the validation failure, but not the TCP failure.  For the other name, I get it to respond too slowly, and give this log message (on high verbosity):
```debug: tcp took too long, dropped```
The newer unbound releases have gradual TCP management, where if the TCP is overloaded, the TCP timeout is reduced.  The second name has a nameserver that produces timeouts for queries, and lookups take too long.  The TCP connection is dropped.  Eventually that would produce a SERVFAIL in cache that then answers quickly until it passes out of the cache, and unbound attempts to look up the data again.
Could it be that the nameserver for the cz name occasionally goes down, and then unbound wants to relookup, but it takes a long time.  TCP timeouts are shorter now than they were before (and configurable, I believe), and then it drops the TCP connection.
But 200 ms after the query, that looks like it is the tcp timeout configured with tcp-idle-timeout.  That is reduced to 1% and then 0.2% of the configured value, with a minimum of 200ms.  Looks like the server is full on TCP and the shorter timeout is used.  Meanwhile the lookup is taking long (too long).

**Comment by laurence-pawling** [comment]
Version 1.13.1, 1.17.1, 1.17.1 (Debian 11, 12),

Apologies for re-awakening the old thread, but I see it's still open. We have **exactly** the same problem when the upstream NS times out (except for the 200ms).

Example tcpdump (I've redacted the domain as I don't have the owners permission to post it, but can obtain this). The domain is chosen with Name Servers that will purposefully time out.
```
15:49:47.496617 IP localhost.39508 > localhost.domain: Flags [S], seq 3265488309, win 65495, options [mss 65495,sackOK,TS val 416917374 ecr 0,nop,wscale 7], length 0
15:49:47.496635 IP localhost.domain > localhost.39508: Flags [S.], seq 3333380531, ack 3265488310, win 65483, options [mss 65495,sackOK,TS val 416917374 ecr 416917374,nop,wscale 7], length 0
15:49:47.496647 IP localhost.39508 > localhost.domain: Flags [.], ack 1, win 512, options [nop,nop,TS val 416917374 ecr 416917374], length 0
15:49:47.496802 IP localhost.39508 > localhost.domain: Flags [P.], seq 1:49, ack 1, win 512, options [nop,nop,TS val 416917374 ecr 416917374], length 48 62760+ A? <REDACTED.COM>. (46)
15:49:47.496811 IP localhost.domain > localhost.39508: Flags [.], ack 49, win 512, options [nop,nop,TS val 416917374 ecr 416917374], length 0

15:50:04.975541 IP localhost.domain > localhost.39508: Flags [F.], seq 1, ack 49, win 512, options [nop,nop,TS val 416934853 ecr 416917374], length 0
15:50:04.975894 IP localhost.39508 > localhost.domain: Flags [F.], seq 49, ack 2, win 512, options [nop,nop,TS val 416934853 ecr 416934853], length 0
15:50:04.975912 IP localhost.domain > localhost.39508: Flags [.], ack 50, win 512, options [nop,nop,TS val 416934853 ecr 416934853], length 0
```

The FreeBSD build of the same version returns a PUSH/ACK with a ServFail response before closing the connection. The vanilla and Debian builds do not return a ServFail but instead simply close the connection with a FIN/ACK as above. This results in an "EOF" error at the client end because of the unexpected closure.

The debug logs show that unbound is trying to resolve the query on an exponential backoff basis as described in the manual (it looks to be 1 second, 3 seconds, 6 seconds, 6 seconds), before logging the SERVFAIL response but never returning it over the network.
As the above user notes, the offending name server is then logged in the infra cache and unbound will return an immediate SERVFAIL for the configured cache duration - also as expected.

Just trying to work out why the SERVFAIL isn't being sent - is this expected behaviour? Tuning our clients to handle EOF does the job, but it seems heavy-handed.

**Comment by wcawijngaards** [comment]
If unbound logs a servfail response, if should really also return it to the requester. It takes some time for that. But maybe that is no longer connected, there is the `tcp-idle-timeout:` that may come into play and disconnect. Or if tcp keepalive is used perhaps another timeout.

**Comment by laurence-pawling** [comment]
We are not setting tcp-idle-timeout so I expect it should be using the default of 30s: https://unbound.docs.nlnetlabs.nl/en/latest/manpages/unbound.conf.html#unbound-conf-tcp-idle-timeout

There is no other infrastructure between client and server (as per the tcpdump above the test case connects to localhost). I don't believe the timeout can be OS or client-related because we are explicitly seeing the FIN/ACK packet from unbound - It times out in the same way as the FreeBSD-based server (after a touch over 17 seconds) with the only difference being that the SERVFAIL message is pushed before the FIN/ACK is sent.

We have also tested the same behaviour on 1.22.0 on Debian 13 with the same config (and also with the vanilla config), although the timeout happens slightly earlier at 12s (which I would assume is from tuning of how many retries are made before adding the name servers to the infra cache, but haven't had a chance to check the debug logs yet).

**Comment by wcawijngaards** [comment]
Because of the idle timeout, the clients have to be tuned to handle EOF cases. Because those timeouts happen. Also when the server is busy the timeouts are (very much) smaller. So the client code has to deal with EOF on the stream.

Apart from that, I also do not know why the Linux version behave different from FreeBSD. The FreeBSD behaviour also looks better, so what makes the packet stop. Is it that the TCP reassembly is waiting (like for an ACK or couple msec), and the buffer is dropped when the connection is closed, perhaps. The unbound code uses the `close()` method to stop the TCP channel, when it is done. With verbosity 4 or more unbound logs a more details, and this can show that it is working, like on FreeBSD, and attempting to send a reply. Also the options `log-replies: yes` and `log-destaddr: yes` printout the reply that Unbound is sending, in the log. That can be a way to see what Unbound is doing.
