### ISSUE TITLE
Issues with resolving using getaddrinfo (two simultaneous DNS requests from same port)

### ISSUE THREAD

**Issue by znkr** [NLnetLabs/unbound#424]
I have been investigating a DNS lookup issue on my local network that seems to stem from a combination of glibc's implementation of getaddrinfo and Unbound DNS. The problem usually manifests itself in a ~5s delay before a connection is established. I can reliably trigger this condition with the following program:

```
#include <sys/types.h>
#include <sys/socket.h>
#include <netdb.h>
#include <stdio.h>
#include <unistd.h>

int main(int argc, char *argv[])
{
    struct addrinfo *res;
    int rc=getaddrinfo(argv[1], "http", NULL, &res);

    printf("getaddrinfo returned %d\n", rc);

    if (rc == 0)
        freeaddrinfo(res);
}
```

When I run this program it looks like this:

```
$ time ./a.out heise.de
getaddrinfo returned 0

real	0m5.018s
user	0m0.000s
sys	0m0.004s
```

And (using tcpdump) I see one of two traffic patterns (on both the client and the server). Either the traffic looks like this

```
18:58:57.473342 IP 10.0.1.7.57832 > 10.0.1.1.53: 12887+ A? heise.de. (26)
18:58:57.473371 IP 10.0.1.7.57832 > 10.0.1.1.53: 44126+ AAAA? heise.de. (26)
18:58:57.475099 IP 10.0.1.1.53 > 10.0.1.7.57832: 44126 1/0/0 AAAA 2a02:2e0:3fe:1001:302:: (54)
18:59:02.478389 IP 10.0.1.7.57832 > 10.0.1.1.53: 12887+ A? heise.de. (26)
18:59:02.479246 IP 10.0.1.1.53 > 10.0.1.7.57832: 12887 1/0/0 A 193.99.144.80 (42)
18:59:02.479337 IP 10.0.1.7.57832 > 10.0.1.1.53: 44126+ AAAA? heise.de. (26)
18:59:02.479755 IP 10.0.1.1.53 > 10.0.1.7.57832: 44126 1/0/0 AAAA 2a02:2e0:3fe:1001:302:: (54)
```

or it looks like this

```
18:59:12.504525 IP 10.0.1.7.50399 > 10.0.1.1.53: 5644+ A? heise.de. (26)
18:59:12.504581 IP 10.0.1.7.50399 > 10.0.1.1.53: 31252+ AAAA? heise.de. (26)
18:59:12.505954 IP 10.0.1.1.53 > 10.0.1.7.50399: 5644 1/0/0 A 193.99.144.80 (42)
18:59:17.509496 IP 10.0.1.7.50399 > 10.0.1.1.53: 5644+ A? heise.de. (26)
18:59:17.510501 IP 10.0.1.1.53 > 10.0.1.7.50399: 5644 1/0/0 A 193.99.144.80 (42)
18:59:17.510611 IP 10.0.1.7.50399 > 10.0.1.1.53: 31252+ AAAA? heise.de. (26)
18:59:17.511055 IP 10.0.1.1.53 > 10.0.1.7.50399: 31252 1/0/0 AAAA 2a02:2e0:3fe:1001:302:: (54)
```

That is, my client (10.0.1.7; Debian 10) sends two requests using the same UDP port, one for the A and one for the AAAA record. However, Unbound (10.0.1.1; OPNsense 21.1.1) only answers one of them initially. Later both of those requests are served. Furthermore, when enabling request logging in Unbound, only one of the initial two requests is logged.

Another interesting observation, is that successive calls to `getaddrinfo` for don't have the same problem (even when looking up diffrent domains).

This problem disappears when using `options single-request` in `/etc/resolve.conf`. However, I can't do that for every affected machine in my home: I have a Synology NAS and it is affected as well.

This problem seems to be well known (e.g. https://bugzilla.redhat.com/show_bug.cgi?id=459756), but I did not find an issue about it in this tracker. Appologies if this is a duplicate.

I also took a look through the code base to see if I can fix this bug myself, but I don't really have a clue. My best bet is that some events are dropped when requests arrive nearly simultaneously. I don't know what the reason is, but tcpdump shows that sucessive calls have a longer delay between the DNS requests.

```
19:56:44.760471 IP 10.0.1.7.44566 > 10.0.1.1.53: 48161+ A? heise.de. (26)
19:56:44.760500 IP 10.0.1.7.44566 > 10.0.1.1.53: 57895+ AAAA? heise.de. (26)
19:56:44.761752 IP 10.0.1.1.53 > 10.0.1.7.44566: 57895 1/0/0 AAAA 2a02:2e0:3fe:1001:302:: (54)
19:56:49.765386 IP 10.0.1.7.44566 > 10.0.1.1.53: 48161+ A? heise.de. (26)
19:56:49.766307 IP 10.0.1.1.53 > 10.0.1.7.44566: 48161 1/0/0 A 193.99.144.80 (42)
19:56:49.766367 IP 10.0.1.7.44566 > 10.0.1.1.53: 57895+ AAAA? heise.de. (26)
19:56:49.766848 IP 10.0.1.1.53 > 10.0.1.7.44566: 57895 1/0/0 AAAA 2a02:2e0:3fe:1001:302:: (54)
19:56:49.768002 IP 10.0.1.7.39166 > 10.0.1.1.53: 64667+ A? google.com. (28)
19:56:49.768940 IP 10.0.1.1.53 > 10.0.1.7.39166: 64667 1/0/0 A 172.217.22.238 (44)
19:56:49.769021 IP 10.0.1.7.39166 > 10.0.1.1.53: 64673+ AAAA? google.com. (28)
19:56:49.769838 IP 10.0.1.1.53 > 10.0.1.7.39166: 64673 1/0/0 AAAA 2a00:1450:4016:806::200e (56)
```

**Comment by wcawijngaards** [comment]
Unbound should be able to answer two request from the same port at the same time.  Because lookups vary in lookup time, especially when the cache is empty, the response to the two queries is going to take a different amount of time, and it should answer the first and then the next one when it is done.

If unbound does not log both requests, that means they did not arrive at the unbound query port.  Only one arrived.  Are you using TCP and an older version of unbound?  That would process the queries one by one.

For UDP, that means the message did not arrive. Unbound logs the request after it did the udp receive, so if it does not log the query, then it likely did not receive anything on the UDP socket.  This is weird, since your tcp dump shows it.  How is that possible?  Is there some sort of VM and firewall or connection tracking?

**Comment by znkr** [comment]
Yeah, this is weird.  I am checked that it's using UDP (tcpdump wasn't really obvious about it). I also ran tcpdump on the opnsense box too and it showed the same result, so the packet did at least arrive on the interface. The default firewall for that interface is configured, but it allows everything on that interface.

Maybe a race condition?

**Comment by znkr** [comment]
Okay, disabling the firewall completly fixes the issue... I'll report this in the opnsense issue tracker instead. Thanks!

**Comment by znkr** [comment]
https://github.com/opnsense/core/issues/4708
